Commit Message,Author,PR Link,Team,Change Type
chore: add new track events for enabling/disabling basic functionality (#11088),Vince Howard,https://github.com/MetaMask/metamask-mobile/pull/11088,team-wallet-ux,Changed
fix: camera permission alert with settings access (#10673),Vince Howard,https://github.com/MetaMask/metamask-mobile/pull/10673,team-wallet-ux,Fixed
"feat(2796):  permission settings for multichain, behind feature flag (#10833)",EtherWizard33,https://github.com/MetaMask/metamask-mobile/pull/10833,team-wallet-ux,Added
fix(2795): remove duplicate description in account connect multiselect screen (#10851),EtherWizard33,https://github.com/MetaMask/metamask-mobile/pull/10851,team-wallet-ux,Fixed
chore: update gitignore (#10781),Vince Howard,https://github.com/MetaMask/metamask-mobile/pull/10781,team-wallet-ux,Changed
feat: 2805 grant permission to network with missmatching rpc url (#10747),EtherWizard33,https://github.com/MetaMask/metamask-mobile/pull/10747,team-wallet-ux,Added
feat: 2795 disconnect all account permission multichain edit account screen (#10715),EtherWizard33,https://github.com/MetaMask/metamask-mobile/pull/10715,team-wallet-ux,Added
feat: 7.30.0 (#10750),github-actions[bot],https://github.com/MetaMask/metamask-mobile/pull/10750,team-mobile-platform,Added
New Crowdin translations by Github Action (#10760),MetaMask Bot,https://github.com/MetaMask/metamask-mobile/pull/10760,team-mobile-platform,Unknown
chore: fix flipper pod compilation with pika 15.3 toolchain (#11080),João Loureiro,https://github.com/MetaMask/metamask-mobile/pull/11080,team-mobile-platform,Changed
chore: disable api spec pipeline (#11077),Curtis David,https://github.com/MetaMask/metamask-mobile/pull/11077,team-mobile-platform,Changed
test: disable flakey accounts test (#11075),Curtis David,https://github.com/MetaMask/metamask-mobile/pull/11075,team-mobile-platform,Changed
test: set baseline for app launch times (#11074),Curtis David,https://github.com/MetaMask/metamask-mobile/pull/11074,team-mobile-platform,Changed
test: Update swap test to handle the details modal (#11039),SamuelSalas,https://github.com/MetaMask/metamask-mobile/pull/11039,team-mobile-platform,Changed
test: remove duplicate push_branch in trigger map (#11070),Curtis David,https://github.com/MetaMask/metamask-mobile/pull/11070,team-mobile-platform,Changed
test: enable launch times pipeline on main (#11037),Curtis David,https://github.com/MetaMask/metamask-mobile/pull/11037,team-mobile-platform,Changed
fix: browser tab url type (#10894),Nico MASSART,https://github.com/MetaMask/metamask-mobile/pull/10894,team-mobile-platform,Fixed
chore: cherry pick sync hot fixes 7.29.1 & 7.29.2 (#11016),sethkfman,https://github.com/MetaMask/metamask-mobile/pull/11016,team-mobile-platform,Ops
feat: 7.29.2 (#10984),github-actions[bot],https://github.com/MetaMask/metamask-mobile/pull/10984,team-mobile-platform,Added
feat: 7.29.1 (#10841),github-actions[bot],https://github.com/MetaMask/metamask-mobile/pull/10841,team-mobile-platform,Added
chore: cherry pick swaps PR (#11010),tommasini,https://github.com/MetaMask/metamask-mobile/pull/11010,team-mobile-platform,Ops
chore: Metrics on download logs on login screen (#10983),tommasini,https://github.com/MetaMask/metamask-mobile/pull/10983,team-mobile-platform,Changed
chore: revert splash screen PR (#11012),tommasini,https://github.com/MetaMask/metamask-mobile/pull/11012,team-mobile-platform,Changed
chore: update swaps controller to 9.0.12 (#11003),tommasini,https://github.com/MetaMask/metamask-mobile/pull/11003,team-mobile-platform,Changed
chore: merge release 7.29.1 into main (#11000),Daniel Cross,https://github.com/MetaMask/metamask-mobile/pull/11000,team-mobile-platform,Changed
chore: remove prefer default export eslint rule (#10937),tommasini,https://github.com/MetaMask/metamask-mobile/pull/10937,team-mobile-platform,Changed
fix: Update PRODUCTION_APP_URL value (#10963),SamuelSalas,https://github.com/MetaMask/metamask-mobile/pull/10963,team-mobile-platform,Fixed
chore(deps): bump rexml from 3.3.3 to 3.3.6 in the bundler group across 1 directory (#10749),dependabot[bot],https://github.com/MetaMask/metamask-mobile/pull/10749,team-mobile-platform,Ops
test: Increase cold start bench marks (#10958),Curtis David,https://github.com/MetaMask/metamask-mobile/pull/10958,team-mobile-platform,Changed
chore: Cherry pick reCaptcha fix (#10908),tommasini,https://github.com/MetaMask/metamask-mobile/pull/10908,team-mobile-platform,Changed
chore: cherry pick d98a1c9 fix(notifications): hide profile sync toggle  (#10951),sethkfman,https://github.com/MetaMask/metamask-mobile/pull/10951,team-mobile-platform,Ops
fix(bug report): the description of bug report issue wasn't up-to-date anymore (#10903),Gauthier Petetin,https://github.com/MetaMask/metamask-mobile/pull/10903,team-mobile-platform,Fixed
chore: Update Keystone and NGRAVE dependencies (#10016),Mark Stacey,https://github.com/MetaMask/metamask-mobile/pull/10016,team-mobile-platform,Changed
chore: update typescript version to v~5.4.5 (#10866),tommasini,https://github.com/MetaMask/metamask-mobile/pull/10866,team-mobile-platform,Changed
fix: recaptcha on in app browser (#10886),tommasini,https://github.com/MetaMask/metamask-mobile/pull/10886,team-mobile-platform,Fixed
fix: Upgrading Appium test failing (#10826),SamuelSalas,https://github.com/MetaMask/metamask-mobile/pull/10826,team-mobile-platform,Changed
fix: Browser dialog prompts in app (#10540),Daniel Cross,https://github.com/MetaMask/metamask-mobile/pull/10540,team-mobile-platform,Fixed
fix: Refactor `yarn setup` in CI to generate terms of use content while retaining performance optimization (#10844),Cal Leung,https://github.com/MetaMask/metamask-mobile/pull/10844,team-mobile-platform,Fixed
fix: remove exclusion of micromatch advisory and bump it (#10850),tommasini,https://github.com/MetaMask/metamask-mobile/pull/10850,team-mobile-platform,Ops
fix: Add missing react-native-slider to pod lock file (#10845),Cal Leung,https://github.com/MetaMask/metamask-mobile/pull/10845,team-mobile-platform,Fixed
"revert: ""fix: Fixed 17 High Priority Issues - SonarCloud"" (#10843)",sethkfman,https://github.com/MetaMask/metamask-mobile/pull/10843,team-mobile-platform,Fixed
fix: Fixed 17 High Priority Issues - SonarCloud (#10635),devin-ai-integration[bot],https://github.com/MetaMask/metamask-mobile/pull/10635,team-mobile-platform,Fixed
chore: Enable typescript coverage for all the files (#10745),tommasini,https://github.com/MetaMask/metamask-mobile/pull/10745,team-mobile-platform,Changed
chore(runway): cherry-pick fix: Fix/disable flipper for release (#10839),runway-github[bot],https://github.com/MetaMask/metamask-mobile/pull/10839,team-mobile-platform,Ops
chore: Bump old pod checksums (#10830),Cal Leung,https://github.com/MetaMask/metamask-mobile/pull/10830,team-mobile-platform,Changed
test: Remove Redundant Steps in WDIO to Fix Upgrade Test Failures (#10835),yande,https://github.com/MetaMask/metamask-mobile/pull/10835,team-mobile-platform,Changed
chore: Remove react-native-splash-screen from Android (#10813),Kylan Hurt,https://github.com/MetaMask/metamask-mobile/pull/10813,team-mobile-platform,Changed
chore: Add troubleshoot for missing simulators (#10828),Cal Leung,https://github.com/MetaMask/metamask-mobile/pull/10828,team-mobile-platform,Changed
fix: Fix/disable flipper for release (#10827),Cal Leung,https://github.com/MetaMask/metamask-mobile/pull/10827,team-mobile-platform,Fixed
chore: Update permission controller to v^11 & utils to v^9 (#10736),tommasini,https://github.com/MetaMask/metamask-mobile/pull/10736,team-mobile-platform,Changed
chore(runway): cherry-pick fix: Set NO_FLIPPER to true on ios release (#10824),runway-github[bot],https://github.com/MetaMask/metamask-mobile/pull/10824,team-mobile-platform,Ops
fix: Set NO_FLIPPER to true on ios release (#10820),Cal Leung,https://github.com/MetaMask/metamask-mobile/pull/10820,team-mobile-platform,Fixed
chore: cherry pick 10533 (#10823),sethkfman,https://github.com/MetaMask/metamask-mobile/pull/10823,team-mobile-platform,Ops
chore: bump version 1399 RC 2 (#10822),Daniel Cross,https://github.com/MetaMask/metamask-mobile/pull/10822,team-mobile-platform,Ops
test:update-bs-url-to-correct-url (#10814),yande,https://github.com/MetaMask/metamask-mobile/pull/10814,team-mobile-platform,Changed
chore: typescript coverage (#10744),Daniel Cross,https://github.com/MetaMask/metamask-mobile/pull/10744,team-mobile-platform,Changed
test: Refactor swaps page object files (#10785),SamuelSalas,https://github.com/MetaMask/metamask-mobile/pull/10785,team-mobile-platform,Changed
fix: update metrics logic (#10545),Nico MASSART,https://github.com/MetaMask/metamask-mobile/pull/10545,team-mobile-platform,Fixed
Release-update-BS-URL (#10794),yande,https://github.com/MetaMask/metamask-mobile/pull/10794,team-mobile-platform,Unknown
docs: Clean up testing readme (#10723),Curtis David,https://github.com/MetaMask/metamask-mobile/pull/10723,team-mobile-platform,Changed
fix: typescript vs code default version (#10761),tommasini,https://github.com/MetaMask/metamask-mobile/pull/10761,team-mobile-platform,Fixed
fix: Fix coachmark error (#10753),Cal Leung,https://github.com/MetaMask/metamask-mobile/pull/10753,team-mobile-platform,Fixed
chore: chore/7.30.0-Changelog (#10751),github-actions[bot],https://github.com/MetaMask/metamask-mobile/pull/10751,team-mobile-platform,Changed
fix: UI notifications details bugs (#10982),Jonathan Ferreira,https://github.com/MetaMask/metamask-mobile/pull/10982,"team-notifications,team-snaps-platform",Fixed
fix: small UI polishings (#10795),Jonathan Ferreira,https://github.com/MetaMask/metamask-mobile/pull/10795,"team-notifications,team-snaps-platform",Fixed
fix: refactor notifications utils (#10792),Jonathan Ferreira,https://github.com/MetaMask/metamask-mobile/pull/10792,"team-notifications,team-snaps-platform",Changed
fix: wallet connect invalid hostname (#10979),abretonc7s,https://github.com/MetaMask/metamask-mobile/pull/10979,team-sdk,Fixed
fix: wrong or missing analytics request source (#10701),Andrea Salvatore,https://github.com/MetaMask/metamask-mobile/pull/10701,team-sdk,Fixed
chore: cherry-pick #10863 connectWith SDK fix (#10896),github-actions[bot],https://github.com/MetaMask/metamask-mobile/pull/10896,team-sdk,Ops
fixes: connectWith sdk (#10863),abretonc7s,https://github.com/MetaMask/metamask-mobile/pull/10863,team-sdk,Fixed
chore: cherry-pick #10695 (#10759),github-actions[bot],https://github.com/MetaMask/metamask-mobile/pull/10759,team-sdk,Ops
chore: cherry-pick #10347 (#10762),github-actions[bot],https://github.com/MetaMask/metamask-mobile/pull/10762,team-sdk,Ops
feat: refactor WalletConnect v2 and add unit tests (#10347),Andrea Salvatore,https://github.com/MetaMask/metamask-mobile/pull/10347,team-sdk,Added
feat: sdk async key exchange (#10695),abretonc7s,https://github.com/MetaMask/metamask-mobile/pull/10695,team-sdk,Added
fix: refactor blockaid utils sync functions to async (#10518),Vinicius Stevam,https://github.com/MetaMask/metamask-mobile/pull/10518,team-confirmations,Changed
fix: support set custom nonce to zero (#10729),Vinicius Stevam,https://github.com/MetaMask/metamask-mobile/pull/10729,team-confirmations,Fixed
fix: Fix broken unit test in `Sendflow` tests (#11020),OGPoyraz,https://github.com/MetaMask/metamask-mobile/pull/11020,team-confirmations,Changed
fix: no insufficient funds warning (#10385),OGPoyraz,https://github.com/MetaMask/metamask-mobile/pull/10385,team-confirmations,Changed
fix: infinite gas fee loading during send (#11002),Matthew Walsh,https://github.com/MetaMask/metamask-mobile/pull/11002,team-confirmations,Fixed
fix: Add missing allowedAction NetworkController:findNetworkClientIdByChainId to transactionController (#10936),Jyoti Puri,https://github.com/MetaMask/metamask-mobile/pull/10936,team-confirmations,Fixed
fix: gas never loading during send + high gas fee after deep link (#10965),Matthew Walsh,https://github.com/MetaMask/metamask-mobile/pull/10965,team-confirmations,Fixed
fix: blockaid loader on confirmation pages (#10662),Jyoti Puri,https://github.com/MetaMask/metamask-mobile/pull/10662,team-confirmations,Fixed
refactor: updated button primary to use light theme colors (#11017),Brian August Nguyen,https://github.com/MetaMask/metamask-mobile/pull/11017,team-design-system,Changed
refactor: updated wallet action icons to be light themed (#11018),Brian August Nguyen,https://github.com/MetaMask/metamask-mobile/pull/11018,team-design-system,Changed
fix: Add dark mode to storybook (#10286),Brian August Nguyen,https://github.com/MetaMask/metamask-mobile/pull/10286,team-design-system,Fixed
fix: updated Text to use proper font styles (#9962),Brian August Nguyen,https://github.com/MetaMask/metamask-mobile/pull/9962,team-design-system,Fixed
chore: updated avatargroup to take in all avatars (#10325),Brian August Nguyen,https://github.com/MetaMask/metamask-mobile/pull/10325,team-design-system,Changed
chore(runway): cherry-pick feat: Update Polygon from `MATIC` to `POL` (#10959),runway-github[bot],https://github.com/MetaMask/metamask-mobile/pull/10959,team-assets,Added
chore: cherry-pick #10961 to new controller version (#11015),sethkfman,https://github.com/MetaMask/metamask-mobile/pull/11015,team-assets,Ops
feat: Update Polygon from `MATIC` to `POL` (#10831),Nick Gambino,https://github.com/MetaMask/metamask-mobile/pull/10831,team-assets,Added
fix: fix sentry error (#10476),sahar-fehri,https://github.com/MetaMask/metamask-mobile/pull/10476,team-assets,Fixed
feat: New token detail view (#10562),Nick Gambino,https://github.com/MetaMask/metamask-mobile/pull/10562,team-assets,Added
chore: upgrade network controller to version 19.0.0 (#10616),salimtb,https://github.com/MetaMask/metamask-mobile/pull/10616,team-assets,Changed
test: Fix swap smoke tests (#11001),Davide Brocchetto,https://github.com/MetaMask/metamask-mobile/pull/11001,team-swaps,Changed
fix: Optimism quotes failing (#10687),infiniteflower,https://github.com/MetaMask/metamask-mobile/pull/10687,team-swaps,Fixed
test: replaced TestHelpers function call with equivalent from Assertions  (#10953),Davide Brocchetto,https://github.com/MetaMask/metamask-mobile/pull/10953,team-swaps,Changed
test: Fix Swap e2e test failure (#10897),Davide Brocchetto,https://github.com/MetaMask/metamask-mobile/pull/10897,team-swaps,Changed
chore: add new `keyring-snaps` code fence (#10874),Owen Craston,https://github.com/MetaMask/metamask-mobile/pull/10874,team-accounts,Changed
test: e2e srp reveal regression update (#10913),Mike B,https://github.com/MetaMask/metamask-mobile/pull/10913,team-accounts,Changed
test: e2e to reveal private key (#10879),Mike B,https://github.com/MetaMask/metamask-mobile/pull/10879,team-accounts,Changed
test: complete quiz to reveal SRP (#10754),Mike B,https://github.com/MetaMask/metamask-mobile/pull/10754,team-accounts,Changed
fix(notifications): hide profile sync toggle (#10900),Prithpal Sooriya,https://github.com/MetaMask/metamask-mobile/pull/10900,team-notifications,Fixed
chore: enable merge queues gh action test run (#10871),Daniel Cross,https://github.com/MetaMask/metamask-mobile/pull/10871,team-mobile-delivery,Changed
feat: 7.29.0 (#10533),github-actions[bot],https://github.com/MetaMask/metamask-mobile/pull/10533,team-mobile-delivery,Added
test: Refactor AccountListView Page object (#10714),devin-ai-integration[bot],https://github.com/MetaMask/metamask-mobile/pull/10714,team-ai,Changed
fix: refactor saga xhr injection and add unit tests (#9910),legobeat,https://github.com/MetaMask/metamask-mobile/pull/9910,team-security,Changed
feat: js bundle size ci gate (#10876),jake-perkins,https://github.com/MetaMask/metamask-mobile/pull/10876,team-mmig-dso,Added
feat: add pooled staking feature flag (#10847),Amitabh Aggarwal,https://github.com/MetaMask/metamask-mobile/pull/10847,team-stake,Added
Chore: Bump version 1401 RC3 (#10838),Daniel Cross,https://github.com/MetaMask/metamask-mobile/pull/10838,,Unknown
fix: Fix the QR code account unable to sign any message and transaction issue in 7.30.0 (#10791),Xiaoming Wang,https://github.com/MetaMask/metamask-mobile/pull/10791,team-hardware-wallets,Fixed
chore: cherry-pick #10727 (#10796),github-actions[bot],https://github.com/MetaMask/metamask-mobile/pull/10796,team-hardware-wallets,Ops
feat: add ledger live deviation path support (#10727),Xiaoming Wang,https://github.com/MetaMask/metamask-mobile/pull/10727,"team-accounts,team-hardware-wallets",Added
"fix: add @react-native-community/datetimepicker, @react-native-community/slider (#10694)",legobeat,https://github.com/MetaMask/metamask-mobile/pull/10694,team-lavamoat,Fixed